{
  "evidence_boundary": {
    "answer_recovery_evaluated": false,
    "environment_content_inspected_for_selection": false,
    "environment_noninspection_claim_basis": "tool_input_allowlist_plus_procedural_research_boundary_not_global_authentication",
    "environment_noninspection_machine_authenticated": false,
    "evidence_class": "ai_exploratory_non_human_non_gold",
    "execution_evaluated": false,
    "gold_claimed": false,
    "grounding_evaluated": false,
    "human_evidence_count": 0,
    "modeling_ready_claimed": false,
    "semantic_correctness_evaluated": false
  },
  "family_count": 30,
  "limitations": {
    "feature_axes_are_correlated": true,
    "n100_new200_and_producer_context_are_partly_confounded": true,
    "prevalence_estimation_supported": false,
    "probability_sample": false,
    "producer_partitions_are_independent_reviewers": false,
    "rare_families_deliberately_overrepresented": true,
    "status_and_alternative_presence_are_ai_generated_diagnostics": true
  },
  "schema_version": "representative_coverage_selection_v0_1",
  "selected_family_count": 30,
  "selected_question_count": 71,
  "selected_question_ids": [
    "653d221ec832d13c",
    "0d48bffa70ef4acf",
    "735834c0f75f137a",
    "75a7ccb3abefa128",
    "736e042b2c205104",
    "63cf68ef83853c8a",
    "7dc78b5327210208",
    "8259c70c392c5b75",
    "c787f84fcdd3c4b8",
    "e9232821cf7ef702",
    "1e674ae4b655c1a1",
    "1ca8ffcd3e20e498",
    "9b030f07965328b8",
    "82b28c175b1cb108",
    "c67ea18da325ac4d",
    "ba563b015b09bf21",
    "411562d9ce68b1e8",
    "8fb7b7d6e47937e7",
    "e8f872dde8b82875",
    "50d916167643e093",
    "0ccec805fd3393f1",
    "ad20a4c31ba3dba9",
    "f08600ded0c4be3f",
    "0f7b9d689e856c5a",
    "5ed50dcd4d5264ab",
    "67f5d01fa7df9bed",
    "b99fc5c636ea823c",
    "773655dc61bff645",
    "89460c0d91f35d50",
    "d8b4bad4f5a73509",
    "cc681cfdba9badd5",
    "3dc3aaaa06cbfc49",
    "c722cd2efc12bd14",
    "016665beb450ca4e",
    "857ba79b2fe601be",
    "846fc6ee43ca7f7d",
    "21148417ac3a50ca",
    "3d207ccb8be56fd9",
    "2bd28d7d29059abf",
    "bd8704d4254c01c6",
    "7c3e89b072c6145f",
    "05d8934842b3479c",
    "dcedafe32d109937",
    "bafd6781c04a1897",
    "078b72dd6976dc29",
    "b7e8bf58404aba35",
    "42a182821bb86560",
    "e4fdd71f9bcd619c",
    "0503a6ef0129abd8",
    "d00587e410e6a6fb",
    "743c4e765fcd76e5",
    "2f8484f7e3324d0e",
    "7fdc558f6b822b6a",
    "500759e6b5e9256c",
    "d3b6320429b12095",
    "cfe21c5fecaab724",
    "a021a5ae2b2dec59",
    "eb023128000a9684",
    "09828a9a107af8a4",
    "e2958b5a8eccc251",
    "50f4456de0b2a380",
    "c785e669858ec6f2",
    "9aab93e9f9d29b5c",
    "d0ae5921e77b1e73",
    "0f774ac4950905c4",
    "639da22b64b0a499",
    "1e2e4e4f72a64bbf",
    "8719f5ca3711aa45",
    "0fae312ba3d6ef76",
    "dd7056864066ae9b",
    "2c1e60c344e2b104"
  ],
  "selected_question_ids_ordered_sha256": "5403debe2cbe9c7f55ded0a01b49d7c42bf03e53a71350efe269bbd3c0bdcb2e",
  "selected_question_ids_set_sha256": "9b6e05650834871ce30acc1c2dfde18fc64910dcd238982f5d482f6a31e15680",
  "selection_contract": {
    "all_observed_families_retained_in_library": true,
    "at_least_one_selected_question_per_family": true,
    "environment_or_outcome_used_for_ranking": false,
    "family_output_order": "descending_family_question_count_then_ascending_full_signature",
    "family_resolution": "contracted_semantic_dag",
    "prevalence_representative": false,
    "question_text_used_for_ranking": false,
    "quota_formula": {
      "expression": "min(family_question_count, 1 + ceil(log2(family_question_count)))",
      "family_question_count_domain": "positive_integer",
      "quota_is_a_design_choice_not_a_statistical_law": true
    },
    "sample_kind": "deterministic_family_complete_frequency_rarity_coverage_stress_sample",
    "selection_output_order": "family_output_order_then_within_family_selection_order",
    "within_family_selection": {
      "candidate_iteration_order_affects_result": false,
      "feature_axes": [
        "fine_semantic_dag_signature",
        "topology_shape_signature",
        "task_signature",
        "source_slice",
        "producer_partition",
        "record_status",
        "alternative_graph_presence"
      ],
      "marginal_score": "count_of_axes_whose_candidate_value_is_not_yet_covered_in_family",
      "maximize": true,
      "method": "greedy_equal_axis_marginal_coverage_then_seeded_hash",
      "seed": "hybridqa-candidate-backbone-environment-realization-v0.1",
      "tie_break": "ascending_sha256(seed + NUL + contracted_signature + NUL + question_id)"
    }
  },
  "selection_id": "hybridqa_n300_candidate_backbone_coverage_sample_v0_1",
  "selection_purpose": "candidate_backbone_environment_realization_coverage_stress_test",
  "selections": [
    {
      "committed_position": 290,
      "contracted_signature_sha256": "0a7a0c323418905b141b0c5e0f5db2aaa449b50abbff6ce89bfb6705839400b1",
      "family_evidence_tier": "recurrent",
      "family_frequency_rank": 1,
      "family_frequency_stratum": "dominant_100_plus",
      "family_id": "cbf_v0_1:0a7a0c323418905b141b0c5e0f5db2aaa449b50abbff6ce89bfb6705839400b1",
      "family_question_count": 201,
      "family_quota": 9,
      "feature_values": {
        "alternative_graph_presence": "absent",
        "fine_semantic_dag_signature": "5c9bb3f3e9337c7b7aa8d2985c1dea4a32c4121741361cd6ca24f0fc8204a5ef",
        "producer_partition": "partition_08",
        "record_status": "complete",
        "source_slice": "new200_expansion",
        "task_signature": "0b5e9162c04774a1146ec041dc03dbcf78228cd8343f1fc4b3c8ccc6a1d7e320",
        "topology_shape_signature": "3d98990a59a64b6f6d02da999288150fb9e3beff19e3c77187b02077a23364f6"
      },
      "marginal_new_axis_value_count": 7,
      "newly_covered_axes": [
        "fine_semantic_dag_signature",
        "topology_shape_signature",
        "task_signature",
        "source_slice",
        "producer_partition",
        "record_status",
        "alternative_graph_presence"
      ],
      "question_id": "653d221ec832d13c",
      "question_view_sha256": "6b31edf5cc0f78b220d02798aa5f6d86682a6171531840456b17bfd836d81593",
      "selection_index": 1,
      "tie_break_sha256": "01093d43b763c4315944e66b26355382eef81d18a3a8bcdc6f2e56ff85bdefdb",
      "within_family_selection_order": 1
    },
    {
      "committed_position": 59,
      "contracted_signature_sha256": "0a7a0c323418905b141b0c5e0f5db2aaa449b50abbff6ce89bfb6705839400b1",
      "family_evidence_tier": "recurrent",
      "family_frequency_rank": 1,
      "family_frequency_stratum": "dominant_100_plus",
      "family_id": "cbf_v0_1:0a7a0c323418905b141b0c5e0f5db2aaa449b50abbff6ce89bfb6705839400b1",
      "family_question_count": 201,
      "family_quota": 9,
      "feature_values": {
        "alternative_graph_presence": "present",
        "fine_semantic_dag_signature": "496174738782fd85ac7a27cb24b2c554aec53054b59974bab14ca4d26dc1bc08",
        "producer_partition": "partition_02",
        "record_status": "uncertain",
        "source_slice": "n100_prefix",
        "task_signature": "19c23f4d43675aa4dd7c33ffac5429d0c1832591d8bb8d4405b527bb1c872c70",
        "topology_shape_signature": "1400a7c0cf0dd7800c96bafdeca4e3e40664705a9a5cf92b34c8340e1bb3d5bd"
      },
      "marginal_new_axis_value_count": 7,
      "newly_covered_axes": [
        "fine_semantic_dag_signature",
        "topology_shape_signature",
        "task_signature",
        "source_slice",
        "producer_partition",
        "record_status",
        "alternative_graph_presence"
      ],
      "question_id": "0d48bffa70ef4acf",
      "question_view_sha256": "b8738814986ea950a8d48255661b065e4c001a949bedd12de56b5583dd2090cc",
      "selection_index": 2,
      "tie_break_sha256": "b946eb862f865bd2753826844c3855ca4d870d2bf5c177aca61c3465b6ce5f09",
      "within_family_selection_order": 2
    },
    {
      "committed_position": 111,
      "contracted_signature_sha256": "0a7a0c323418905b141b0c5e0f5db2aaa449b50abbff6ce89bfb6705839400b1",
      "family_evidence_tier": "recurrent",
      "family_frequency_rank": 1,
      "family_frequency_stratum": "dominant_100_plus",
      "family_id": "cbf_v0_1:0a7a0c323418905b141b0c5e0f5db2aaa449b50abbff6ce89bfb6705839400b1",
      "family_question_count": 201,
      "family_quota": 9,
      "feature_values": {
        "alternative_graph_presence": "absent",
        "fine_semantic_dag_signature": "0a7a0c323418905b141b0c5e0f5db2aaa449b50abbff6ce89bfb6705839400b1",
        "producer_partition": "partition_04",
        "record_status": "complete",
        "source_slice": "new200_expansion",
        "task_signature": "7c68d2bead35a3b33cd89651b5a1fbdad9744cd4fc01793ab985fab57fb52d53",
        "topology_shape_signature": "45fbc0e6520ce148fda54d907b025f5709fbd7c23d23938bda8741d86aca0731"
      },
      "marginal_new_axis_value_count": 4,
      "newly_covered_axes": [
        "fine_semantic_dag_signature",
        "topology_shape_signature",
        "task_signature",
        "producer_partition"
      ],
      "question_id": "735834c0f75f137a",
      "question_view_sha256": "0bef671bf19a1ef6461907ecb91de31692a88aab2303a6c9b9e5c71ef98a849b",
      "selection_index": 3,
      "tie_break_sha256": "027c2dfce5e6ab918de37d426b8614fce0ea9961b1cd043b0b9fae73687947ca",
      "within_family_selection_order": 3
    },
    {
      "committed_position": 114,
      "contracted_signature_sha256": "0a7a0c323418905b141b0c5e0f5db2aaa449b50abbff6ce89bfb6705839400b1",
      "family_evidence_tier": "recurrent",
      "family_frequency_rank": 1,
      "family_frequency_stratum": "dominant_100_plus",
      "family_id": "cbf_v0_1:0a7a0c323418905b141b0c5e0f5db2aaa449b50abbff6ce89bfb6705839400b1",
      "family_question_count": 201,
      "family_quota": 9,
      "feature_values": {
        "alternative_graph_presence": "absent",